{"bin_width":0.1,"domain":[1.2,3.9],"edges":[1.2,1.3,1.4,1.5,1.6,1.7,1.8,1.9,2.0,2.1,2.2,2.3,2.4,2.5,2.6,2.7,2.8,2.9,3.0,3.1,3.2,3.3,3.4,3.5,3.6,3.7,3.8,3.9],"overall":[0,1,1,0,4,11,8,19,13,25,32,40,62,79,89,85,73,57,74,56,65,44,26,22,15,2,0],"by_program":{"CNTT":[0,0,0,0,4,11,8,18,12,22,28,31,52,51,65,60,55,47,56,41,51,35,18,14,8,1,0],"CNTT CLC":[0,1,1,0,0,0,0,1,1,3,4,9,10,28,24,25,18,10,18,15,14,9,8,8,7,1,0]},"by_track":{"D22CNPM":[0,0,0,0,0,0,0,0,0,0,0,0,6,16,35,45,37,35,47,36,42,27,16,13,6,1,0],"D22HTTT":[0,0,0,0,4,11,8,18,12,22,28,31,46,35,30,15,18,12,9,5,9,8,2,1,2,0,0],"E22CNPM":[0,1,1,0,0,0,0,1,1,2,3,8,9,19,20,18,9,7,15,11,7,2,2,0,1,0,0],"E22HTTT":[0,0,0,0,0,0,0,0,0,1,1,1,1,7,3,6,5,1,1,1,2,2,3,4,1,0,0],"E22TTNT":[0,0,0,0,0,0,0,0,0,0,0,0,0,2,1,1,4,2,2,3,5,5,3,4,5,1,0]}}